{
  "$schema": "https://json-schema.org/draft/2020-12/schema",
  "$id": "https://toonvara.dev/schemas/video-v1.schema.json",
  "title": "Toonvara Video Definition v1.0",
  "description": "Schema for Toonvara video project JSON files. Covers the six required top-level fields (schema_version, project, video, assets, scenes, output) and their nested structures. Semantic cross-field validation (asset reference resolution, unique character IDs within a scene, action timing within scene bounds) is enforced at the application layer, not in this schema.",
  "type": "object",
  "required": [
    "schema_version",
    "project",
    "video",
    "assets",
    "scenes",
    "output"
  ],
  "additionalProperties": false,
  "properties": {
    "schema_version": {
      "const": "1.0",
      "description": "Schema version identifier. Must be \"1.0\" for this schema revision."
    },
    "project": {
      "$ref": "#/$defs/project"
    },
    "video": {
      "$ref": "#/$defs/video"
    },
    "assets": {
      "$ref": "#/$defs/assets"
    },
    "scenes": {
      "type": "array",
      "minItems": 1,
      "items": {
        "$ref": "#/$defs/scene"
      },
      "description": "Ordered list of scenes that compose the video."
    },
    "output": {
      "$ref": "#/$defs/output"
    }
  },

  "$defs": {
    "vec3": {
      "type": "array",
      "items": {
        "type": "number"
      },
      "minItems": 3,
      "maxItems": 3,
      "description": "A 3-component vector [x, y, z]."
    },

    "project": {
      "type": "object",
      "required": ["name"],
      "additionalProperties": false,
      "properties": {
        "name": {
          "type": "string",
          "minLength": 1,
          "description": "Human-readable project name."
        },
        "seed": {
          "type": "integer",
          "minimum": 0,
          "default": 42,
          "description": "Seed for deterministic procedural features. Does not guarantee bit-identical output across renderers or hardware."
        }
      },
      "description": "Project-level metadata."
    },

    "video": {
      "type": "object",
      "required": ["duration_seconds", "fps", "width", "height"],
      "additionalProperties": false,
      "properties": {
        "duration_seconds": {
          "type": "number",
          "exclusiveMinimum": 0,
          "description": "Total video duration in seconds."
        },
        "fps": {
          "type": "integer",
          "minimum": 1,
          "description": "Frames per second."
        },
        "width": {
          "type": "integer",
          "minimum": 1,
          "description": "Output width in pixels."
        },
        "height": {
          "type": "integer",
          "minimum": 1,
          "description": "Output height in pixels."
        }
      },
      "description": "Video encoding and resolution settings."
    },

    "assets": {
      "type": "object",
      "additionalProperties": false,
      "properties": {
        "characters": {
          "type": "object",
          "additionalProperties": {
            "type": "string",
            "minLength": 1
          },
          "default": {},
          "description": "Map of character asset ID to project-relative file path (GLB/glTF)."
        }
      },
      "description": "Asset declarations referenced by scenes. Keys are stable asset identifiers; values are project-relative paths."
    },

    "scene": {
      "type": "object",
      "required": ["id", "start_frame", "duration_frames"],
      "additionalProperties": false,
      "properties": {
        "id": {
          "type": "string",
          "minLength": 1,
          "description": "Unique scene identifier."
        },
        "start_frame": {
          "type": "integer",
          "minimum": 0,
          "description": "Frame at which this scene begins (inclusive). Must be non-negative."
        },
        "duration_frames": {
          "type": "integer",
          "minimum": 1,
          "description": "Number of frames in this scene. Must be positive."
        },
        "environment": {
          "type": "string",
          "minLength": 1,
          "description": "Environment preset identifier."
        },
        "characters": {
          "type": "array",
          "items": {
            "$ref": "#/$defs/character_instance"
          },
          "default": [],
          "description": "Character instances placed in this scene."
        },
        "audio": {
          "type": "array",
          "items": {
            "$ref": "#/$defs/audio_clip"
          },
          "default": [],
          "description": "Audio clips (music, voice, SFX) placed on this scene's timeline. Toonvara consumes pre-generated audio files — it does not generate audio."
        },
        "camera": {
          "$ref": "#/$defs/camera"
        }
      },
      "description": "A single scene within the video, spanning a contiguous range of frames."
    },

    "character_instance": {
      "type": "object",
      "required": ["id", "asset"],
      "additionalProperties": false,
      "properties": {
        "id": {
          "type": "string",
          "minLength": 1,
          "description": "Unique instance identifier within this scene."
        },
        "asset": {
          "type": "string",
          "minLength": 1,
          "description": "References a key in assets.characters."
        },
        "position": {
          "$ref": "#/$defs/vec3",
          "default": [0, 0, 0],
          "description": "World-space position [x, y, z]. Coordinate system: right-handed, Y-up, meters."
        },
        "rotation": {
          "$ref": "#/$defs/vec3",
          "default": [0, 0, 0],
          "description": "Euler rotation in degrees [x, y, z]."
        },
        "scale": {
          "$ref": "#/$defs/vec3",
          "default": [1, 1, 1],
          "description": "Scale factors [x, y, z]."
        },
        "visible": {
          "type": "boolean",
          "default": true,
          "description": "Whether this character instance is visible."
        },
        "actions": {
          "type": "array",
          "items": {
            "$ref": "#/$defs/character_action"
          },
          "default": [],
          "description": "Scheduled animation actions. Intervals are start-inclusive, end-exclusive."
        },
        "current_expression": {
          "type": "string",
          "minLength": 1,
          "description": "Active facial expression name."
        }
      },
      "description": "A character placed in a scene with position, orientation, and scheduled actions."
    },

    "character_action": {
      "type": "object",
      "required": ["clip", "start_frame", "duration_frames"],
      "additionalProperties": false,
      "properties": {
        "clip": {
          "type": "string",
          "minLength": 1,
          "description": "Animation clip name. Must exist in the character's available clips."
        },
        "fallback_clip": {
          "type": "string",
          "minLength": 1,
          "description": "Explicit replacement clip if clip is missing. The fallback must exist."
        },
        "speed": {
          "type": "number",
          "exclusiveMinimum": 0,
          "default": 1.0,
          "description": "Finite positive source-animation speed multiplier. Scheduled start and duration do not change."
        },
        "loop": {
          "type": "boolean",
          "default": true,
          "description": "Wrap source animation time; false plays once and holds the last pose until the scheduled end."
        },
        "blend_in_frames": {
          "type": "integer",
          "minimum": 0,
          "default": 0,
          "description": "Fade-in duration in timeline frames (less than duration_frames), independent of speed. Overlaps must exactly match this duration; at most two actions may overlap."
        },
        "start_frame": {
          "type": "integer",
          "minimum": 0,
          "description": "Frame at which this action begins (relative to scene start, inclusive). Must be non-negative."
        },
        "duration_frames": {
          "type": "integer",
          "minimum": 1,
          "description": "Duration in frames. Must be positive."
        }
      },
      "description": "A single animation action scheduled on a character."
    },

    "audio_clip": {
      "type": "object",
      "required": ["path", "start_frame", "type"],
      "additionalProperties": false,
      "properties": {
        "path": {
          "type": "string",
          "minLength": 1,
          "description": "Project-relative path to the audio file (.wav or .mp3)."
        },
        "start_frame": {
          "type": "integer",
          "minimum": 0,
          "description": "Frame at which playback begins (relative to scene start)."
        },
        "volume": {
          "type": "number",
          "minimum": 0,
          "maximum": 1,
          "default": 1.0,
          "description": "Playback volume from 0.0 (silent) to 1.0 (full)."
        },
        "type": {
          "type": "string",
          "enum": ["music", "voice", "sfx"],
          "description": "Semantic category of the audio clip."
        }
      },
      "description": "A pre-generated audio clip (music, voice-over, or sound effect) to be mixed into the video."
    },

    "camera": {
      "type": "object",
      "required": ["position", "target"],
      "additionalProperties": false,
      "properties": {
        "projection": {
          "type": "string",
          "enum": ["perspective", "orthographic"],
          "default": "perspective",
          "description": "Camera projection type."
        },
        "position": {
          "$ref": "#/$defs/vec3",
          "description": "Camera position in world space [x, y, z]."
        },
        "target": {
          "$ref": "#/$defs/vec3",
          "description": "Point the camera looks at [x, y, z]."
        },
        "fov": {
          "type": "number",
          "exclusiveMinimum": 0,
          "maximum": 180,
          "default": 60,
          "description": "Vertical field of view in degrees. Only meaningful for perspective projection."
        }
      },
      "description": "Camera configuration for a scene."
    },

    "output": {
      "type": "object",
      "required": ["format", "path"],
      "additionalProperties": false,
      "properties": {
        "format": {
          "type": "string",
          "enum": ["mp4"],
          "description": "Output video format. Currently only \"mp4\" is supported."
        },
        "path": {
          "type": "string",
          "minLength": 1,
          "description": "Output file path (project-relative). Must not contain absolute paths or path-traversal sequences."
        }
      },
      "description": "Render output settings."
    }
  }
}
